{
  "version": "0.1",
  "renderedAt": "2026-08-10T12:10:00+08:00",
  "renderer": {
    "name": "LibreOffice/soffice",
    "version": "LibreOffice 25.2.0.0"
  },
  "sourceDocument": {
    "fileName": "20260810_UGameRole界面说明.docx",
    "sha256": "eeeeeeeeeeeeeeeeeeeeeeeeeeeeeeeeeeeeeeeeeeeeeeeeeeeeeeeeeeeeeeee"
  },
  "canonicalPdf": {
    "fileName": "20260810_UGameRole\u754c\u9762\u8bf4\u660e.canonical.pdf",
    "sha256": "aaaaaaaaaaaaaaaaaaaaaaaaaaaaaaaaaaaaaaaaaaaaaaaaaaaaaaaaaaaaaaaa",
    "byteSize": 8192
  },
  "canonicalPageRender": {
    "tool": "pdftoppm",
    "version": "pdftoppm version 26.05.0",
    "dpi": 150,
    "pageCount": 1,
    "authoritativePagesGenerated": true
  },
  "pages": [
    {
      "pageNumber": 1,
      "fileName": "page-1.png",
      "sha256": "ffffffffffffffffffffffffffffffffffffffffffffffffffffffffffffffff",
      "byteSize": 4096,
      "width": 1600,
      "height": 2263
    }
  ]
}
